[
  {
    "id": "NaBH4",
    "label": "NaBH₄",
    "name": "Sodium borohydride (in MeOH or EtOH)",
    "shelf": "ch16",
    "kind": "reagent",
    "technique": "pour",
    "card": {
      "does": "Mild hydride. Aldehyde → 1° alcohol, ketone → 2° alcohol (the solvent supplies the proton).",
      "doesNot": "Leaves C=C, esters and carboxylic acids alone."
    }
  },
  {
    "id": "LiAlH4",
    "label": "LiAlH₄",
    "name": "Lithium aluminium hydride (dry ether or THF)",
    "shelf": "ch16",
    "kind": "reagent",
    "technique": "pour",
    "card": {
      "does": "Strong hydride. Aldehydes, ketones, acids and esters → metal alkoxides (an ester gives two). Opens epoxides at the less substituted carbon.",
      "doesNot": "Needs a separate H₂O / H₃O⁺ workup. Does not touch isolated C=C."
    }
  },
  {
    "id": "H2_Pt",
    "label": "H₂, Pt",
    "name": "Hydrogen over platinum (or Pd, Ni)",
    "shelf": "ch16",
    "kind": "reagent",
    "technique": "pressure",
    "card": {
      "does": "Reduces C=C to C–C and aldehyde/ketone C=O to the alcohol.",
      "doesNot": "Not used for esters, acids or benzene rings in this course."
    }
  },
  {
    "id": "Zn_Hg_HCl",
    "label": "Zn(Hg), HCl",
    "name": "Zinc amalgam in hydrochloric acid (Clemmensen)",
    "shelf": "ch16",
    "kind": "reagent",
    "technique": "temperature",
    "techniqueParams": {
      "tempPresets": [
        "rt",
        "reflux"
      ]
    },
    "card": {
      "does": "Aldehyde/ketone C=O → CH₂.",
      "doesNot": "Does not reduce alcohols, esters or acids."
    }
  },
  {
    "id": "H2NNH2_KOH",
    "label": "H₂NNH₂, KOH, Δ",
    "name": "Hydrazine and KOH with heat (Wolff–Kishner)",
    "shelf": "ch16",
    "kind": "reagent",
    "technique": "temperature",
    "techniqueParams": {
      "tempPresets": [
        "rt",
        "reflux"
      ]
    },
    "card": {
      "does": "Aldehyde/ketone C=O → CH₂ (base conditions).",
      "doesNot": "Does not reduce alcohols, esters or acids."
    }
  },
  {
    "id": "PCC",
    "label": "PCC",
    "name": "Pyridinium chlorochromate (dry CH₂Cl₂)",
    "shelf": "ch16",
    "kind": "reagent",
    "technique": "pour",
    "card": {
      "does": "1° alcohol → aldehyde (stops there); 2° alcohol → ketone.",
      "doesNot": "Leaves C=C alone; no acids; does not cleave C–C bonds."
    }
  },
  {
    "id": "H2CrO4",
    "label": "Na₂Cr₂O₇ / H₂SO₄",
    "name": "Chromic acid (Jones reagent)",
    "shelf": "ch16",
    "kind": "reagent",
    "technique": "pour",
    "card": {
      "does": "1° alcohol → carboxylic acid; 2° alcohol → ketone; hydroquinone/catechol → quinone.",
      "doesNot": "3° alcohols: no reaction. Never stops at the aldehyde."
    }
  },
  {
    "id": "HIO4",
    "label": "HIO₄",
    "name": "Periodic acid",
    "shelf": "ch16",
    "kind": "reagent",
    "technique": "pour",
    "card": {
      "does": "Cleaves the C–C bond of a vicinal diol; each carbon becomes an aldehyde or ketone.",
      "doesNot": "Does nothing to an isolated alcohol or a 1,3-diol."
    }
  },
  {
    "id": "OsO4",
    "label": "OsO₄",
    "name": "Osmium tetroxide, then NaHSO₃/H₂O (or cat. OsO₄ + NMO)",
    "shelf": "ch16",
    "kind": "reagent",
    "technique": "pour",
    "card": {
      "does": "Syn dihydroxylation: two OH groups on the same face of a C=C. The C–C bond is kept.",
      "doesNot": "Does not cleave the C=C (that is O₃)."
    }
  },
  {
    "id": "BH3_THF",
    "label": "BH₃·THF",
    "name": "Borane–THF complex",
    "shelf": "ch16",
    "kind": "reagent",
    "technique": "pour",
    "card": {
      "does": "Step 1 of hydroboration: B and H add syn across the C=C, boron on the less substituted carbon.",
      "doesNot": "Gives no alcohol by itself; follow with H₂O₂/NaOH."
    }
  },
  {
    "id": "H2O2_NaOH",
    "label": "H₂O₂, NaOH",
    "name": "Basic hydrogen peroxide (oxidative workup)",
    "shelf": "workup",
    "kind": "workup",
    "technique": "pour",
    "card": {
      "does": "Step 2 of hydroboration: swaps C–B for C–OH with retention.",
      "doesNot": "Does nothing to an alkene on its own."
    }
  },
  {
    "id": "KMnO4",
    "label": "KMnO₄, hot",
    "name": "Hot concentrated potassium permanganate",
    "shelf": "decoy",
    "kind": "decoy",
    "technique": "temperature",
    "techniqueParams": {
      "tempPresets": [
        "rt",
        "reflux"
      ]
    },
    "card": {
      "does": "Strong, unselective oxidant that cleaves C=C bonds.",
      "trap": "Not a toolkit reagent: use OsO₄ for diols, Jones or PCC for alcohols."
    }
  },
  {
    "id": "O3",
    "label": "O₃",
    "name": "Ozone, then Zn or (CH₃)₂S",
    "shelf": "decoy",
    "kind": "decoy",
    "technique": "pour",
    "card": {
      "does": "Cleaves C=C into two carbonyls.",
      "trap": "Decoy for OsO₄: OsO₄ keeps the C–C bond and gives a syn diol."
    }
  },
  {
    "id": "mCPBA",
    "label": "mCPBA",
    "name": "meta-Chloroperoxybenzoic acid (peroxy acid)",
    "shelf": "ch17",
    "kind": "reagent",
    "technique": "pour",
    "techniqueParams": {
      "equivOptions": [
        1,
        2
      ]
    },
    "card": {
      "does": "Alkene → epoxide (syn, stereospecific). Sulfide → sulfoxide (1 equiv) → sulfone (2 equiv).",
      "doesNot": "Not a diol reagent."
    }
  },
  {
    "id": "H2O2",
    "label": "H₂O₂",
    "name": "Hydrogen peroxide",
    "shelf": "ch17",
    "kind": "reagent",
    "technique": "pour",
    "techniqueParams": {
      "equivOptions": [
        1,
        2
      ]
    },
    "card": {
      "does": "Sulfide → sulfoxide with 1 equiv, → sulfone with 2 equiv.",
      "doesNot": "Does not open epoxides or oxidise alcohols here."
    }
  },
  {
    "id": "NaIO4",
    "label": "NaIO₄",
    "name": "Sodium periodate",
    "shelf": "ch17",
    "kind": "reagent",
    "technique": "pour",
    "card": {
      "does": "Sulfide → sulfoxide, and stops there.",
      "doesNot": "Does not go on to the sulfone."
    }
  },
  {
    "id": "I2",
    "label": "I₂",
    "name": "Iodine",
    "shelf": "ch16",
    "kind": "reagent",
    "technique": "pour",
    "card": {
      "does": "Oxidises two thiols to a disulfide RS–SR.",
      "doesNot": "Does not touch alcohols or alkenes here."
    }
  },
  {
    "id": "NBS",
    "label": "NBS",
    "name": "N-Bromosuccinimide",
    "shelf": "ch16",
    "kind": "reagent",
    "technique": "light",
    "techniqueParams": {
      "lightToggle": true
    },
    "card": {
      "does": "With light, peroxide or heat: allylic / benzylic bromination.",
      "doesNot": "Nothing happens in the dark without an initiator."
    }
  },
  {
    "id": "H2O",
    "label": "H₂O",
    "name": "Water (workup, or hydrolysis with heat)",
    "shelf": "workup",
    "kind": "workup",
    "technique": "temperature",
    "smiles": "O",
    "techniqueParams": {
      "tempPresets": [
        "ice",
        "rt",
        "reflux"
      ]
    },
    "card": {
      "does": "Protonates alkoxides, carboxylates and thiolates; quenches Grignards. With heat: Ar–N₂⁺ → Ar–OH.",
      "doesNot": "Does nothing useful before the hydride or Grignard has reacted."
    }
  },
  {
    "id": "H3O_plus",
    "label": "H₃O⁺",
    "name": "Dilute aqueous acid",
    "shelf": "workup",
    "kind": "workup",
    "technique": "workup",
    "smiles": "O",
    "card": {
      "does": "Acidic workup: protonates alkoxides, phenoxides and carboxylates. On an epoxide: trans-diol. On an alkene: Markovnikov hydration.",
      "doesNot": "Kills a Grignard or hydride if added too early."
    }
  },
  {
    "id": "HBr",
    "label": "HBr",
    "name": "Hydrobromic acid (conc.; excess with heat)",
    "shelf": "ch16",
    "kind": "reagent",
    "technique": "light",
    "smiles": "Br",
    "techniqueParams": {
      "lightToggle": true,
      "tempPresets": [
        "rt",
        "reflux"
      ]
    },
    "card": {
      "does": "ROH → RBr (3° fast by SN1, 1° by SN2). Epoxide → bromohydrin at the more substituted carbon. Excess + heat: cleaves ethers to alkyl bromides (an aryl–O bond survives as the phenol).",
      "trap": "Light does nothing useful here; keep the lamp off."
    }
  },
  {
    "id": "HI",
    "label": "HI",
    "name": "Hydroiodic acid (excess, heat)",
    "shelf": "ch17",
    "kind": "reagent",
    "technique": "temperature",
    "smiles": "I",
    "techniqueParams": {
      "tempPresets": [
        "rt",
        "reflux"
      ]
    },
    "card": {
      "does": "Excess + heat: cleaves ethers to alkyl iodides; alkyl aryl ethers → phenol + RI.",
      "doesNot": "Never breaks the aryl–O bond."
    }
  },
  {
    "id": "HCl",
    "label": "HCl",
    "name": "Hydrochloric acid",
    "shelf": "ch16",
    "kind": "reagent",
    "technique": "pour",
    "smiles": "Cl",
    "card": {
      "does": "3° alcohol → 3° chloride (SN1).",
      "doesNot": "1° and 2° alcohols need ZnCl₂ (Lucas) to react."
    }
  },
  {
    "id": "HCl_ZnCl2",
    "label": "HCl / ZnCl₂",
    "name": "Hydrochloric acid with zinc chloride (Lucas)",
    "shelf": "ch16",
    "kind": "reagent",
    "technique": "pour",
    "smiles": "Cl",
    "card": {
      "does": "1°, 2° and 3° alcohols → alkyl chlorides.",
      "doesNot": "Not an oxidant."
    }
  },
  {
    "id": "SOCl2",
    "label": "SOCl₂, pyr",
    "name": "Thionyl chloride with pyridine",
    "shelf": "ch16",
    "kind": "reagent",
    "technique": "pour",
    "card": {
      "does": "ROH → RCl.",
      "doesNot": "Not an oxidant or a reductant."
    }
  },
  {
    "id": "PBr3",
    "label": "PBr₃",
    "name": "Phosphorus tribromide",
    "shelf": "ch16",
    "kind": "reagent",
    "technique": "pour",
    "card": {
      "does": "1°/2° ROH → RBr by SN2, no rearrangement.",
      "doesNot": "Not for 3° alcohols."
    }
  },
  {
    "id": "H2SO4_heat",
    "label": "H₂SO₄, Δ",
    "name": "Sulfuric acid with heat",
    "shelf": "ch16",
    "kind": "reagent",
    "technique": "temperature",
    "techniqueParams": {
      "tempPresets": [